{"schema_version":"demo-story.redhat-intel.com/virtualization-ai-401/operation-request/v1","request_id":"op-401-migration-healthy","operation":"LIVE_MIGRATE","target":{"namespace":"virtualization-ai-401","virtual_machine":"hybrid-workload"},"requested_by":"platform-operator","evidence_snapshot":[{"schema_version":"demo-story.redhat-intel.com/virtualization-ai-401/evidence/v1","evidence_id":"snapshot-401-healthy","request_id":"op-401-migration-healthy","state":"OBSERVE","kind":"KUBEVIRT","source":"rehearsal-fixture","source_state":"REHEARSAL","observed_at":"2026-09-28T18:00:00Z","freshness":"FRESH","digest":"sha256:aaaaaaaaaaaaaaaaaaaaaaaaaaaaaaaaaaaaaaaaaaaaaaaaaaaaaaaaaaaaaaaa","payload":{"vm_identity":"hybrid-workload","placement":"observed-not-asserted"}}],"preflight":{"identity_match":true,"network_compatible":true,"storage_compatible":true,"evidence_fresh":true,"correlation_complete":true},"approval":{"approved_by":"change-reviewer","expires_at":"2027-09-28T18:30:00Z","operation_digest":"sha256:89d7a0bf610a6284b20a5da4cfce58b8c413459f46204f536036b28250cf61f0"},"observed_result":{"operation_complete":true,"infrastructure_success":true,"application_healthy":true,"ai_dependency_healthy":true,"correlation_continuity":true}}
